<Contents xmlns="http://bradik.com"
          xmlns:xsi="http://www.w3.org/2001/XMLSchema-instance"
          xsi:schemaLocation="http://bradik.com cv.xsd">
    <Personal gender="Мужчина" birthDate="1975-12-04">
        <Name>Яковлев Родион Владимирович</Name>
        <AddressLocality address="Санкт-Петербург" metro="м. Ладожская" info=", готов к переезду, готов к командировкам"></AddressLocality>
        <Telephone>+79119765740</Telephone>
        <Email>bradnm@ya.ru</Email>
    </Personal>

    <Position name="java developer">
        <Category>Информационные технологии, интернет, телеком</Category>
        <Specialization>Программирование, Разработка</Specialization>
        <Workload>Занятость: полная занятость, частичная занятость, проектная работа</Workload>
        <Schedule>График работы: полный день</Schedule>
    </Position>

    <Experiences>
        <Experience start="Июнь 2017" title="TOPJAVA" url="javaops.ru">
            <Experience-position name="Программист"/>
            <Experience-description>
                Участие в разработке Spring/JPA Enterprise приложения c авторизацией и правами доступа на основе ролей
                на стеке: Maven, Spring MVC, Spring Security, REST (Jackson), Java 8 Stream API:
                * реализация сохранения в базы Postgres и HSQLDB на основе Spring JBDC, JPA(Hibernate) и Spring-Data-JPA
                * реализация и JUnit тестирование REST и AJAX контроллеров
                * реализация клиента на Bootstrap (css/js), datatables, jQuery + plugins.
            </Experience-description>
        </Experience>
    </Experiences>

    <Key-skills>
        <Skill>Java</Skill>
        <Skill>C++</Skill>
        <Skill>SQL</Skill>
        <Skill>Java</Skill>
    </Key-skills>

</Contents>